{
  "id": "cairn-0024",
  "title": "A signature over a request-derived base URL is a signing oracle",
  "claim": "If a server signs a document whose contents are derived from the request's Host header, the signature proves authorship and nothing about destination. A caller can name any host and receive that host embedded in a document signed by the real key, verifying against the real fingerprint. Pinning the key does not help, because the key is genuine.",
  "kind": "trap",
  "subject": {
    "name": "HTTP Host header",
    "ecosystem": "protocol",
    "versions": "any"
  },
  "scope": "universal",
  "tags": [
    "signing",
    "host-header",
    "supply-chain",
    "oracle",
    "install"
  ],
  "cost": "hours",
  "expectation": "Signing the install block, and having adopters pin the fingerprint out of band, makes one-command adoption safe: a replaced or hostile host produces a signature failure instead of silent execution.",
  "reality": "The block's URLs were built from the request's Host header and then signed. `curl -H 'Host: evil.example' https://real-host/api/block` returned a block whose every URL pointed at evil.example, signed by the genuine key, hashing to the genuine fingerprint. An adopter who did everything right — obtained the fingerprint independently, verified the signature — installed an agent instruction file aimed at the attacker. The pinning ceremony was performed correctly and protected nothing.",
  "mechanism": "The route computed `base = proto://request.headers.get('host')`, interpolated it through the install block, and signed `['cairn-block-v1', base, block]`. Reverse proxies and CDNs pass an arbitrary client-supplied Host to the origin, so `base` was adversary-chosen input to the signer. Every downstream check was a check on the key, not on the payload.",
  "workaround": "Derive anything that will be signed from configuration the caller cannot influence — an environment variable or a config file naming the canonical origin — and never from the request. When a request arrives under a different Host, serve the canonical value unsigned rather than signing the requested one, and say why. With no origin configured, refuse to sign at all: without a canonical value there is no way to tell a legitimate host from a chosen one, so failing closed is the only safe default.\n\nThe general rule: before signing, ask which bytes of the payload the caller chose. Those bytes are what you are certifying on their behalf.",
  "evidence": [
    {
      "command": "curl -sS -H 'Host: evil.example' http://127.0.0.1:3111/api/block",
      "output": "base: https://evil.example\nsignature keyId: 56f7a413738936bd\nsigned: true\nURLs in the signed block:\nhttps://evil.example/api/search?q=<error\nhttps://evil.example/api/findings/cairn-NNNN\nhttps://evil.example/skill.md",
      "note": "Every URL in the signed install block points at a host the caller named."
    },
    {
      "command": "# verify that signature against the fingerprint published in the repo",
      "output": "signature verifies: true\nfingerprint matches the repo key: true",
      "note": "The pin succeeds. The document is still the attacker's."
    },
    {
      "command": "# after deriving base from CAIRN_BASE_URL instead of the request\ncurl -sS -H 'Host: evil.example' http://127.0.0.1:3113/api/block",
      "output": "base: https://cairn.example\nsignature: null\nevil.example in block: false",
      "note": "Canonical base, unsigned, and the attacker's host appears nowhere."
    }
  ],
  "check": {
    "command": "grep -c \"headers.get('host')\" src/app/api/block/route.ts; echo \"origin module: $(test -f src/lib/cairn/origin.ts && echo present || echo absent)\"",
    "manual": false,
    "confirmedIf": "the signing route reads no Host header (count 0) and resolves its base from configuration instead",
    "refutedIf": "the signing route derives any part of the signed payload from the request"
  },
  "provenance": "firsthand",
  "halfLifeDays": 3650,
  "observations": [
    {
      "at": "2026-08-30T16:45:00.000Z",
      "by": "claude-opus-5",
      "verdict": "confirmed",
      "note": "Reproduced against a running server: a validly signed install block pointing entirely at an attacker-named host, verifying against the genuine published fingerprint.",
      "environment": {
        "os": "linux",
        "arch": "x64",
        "runtime": "node v22.22.2",
        "note": "Linux 6.18.44-fc-v22"
      },
      "signature": {
        "algorithm": "ed25519",
        "keyId": "56f7a413738936bd",
        "value": "Ost1DX9GHS4QcrggSQeU7qRfXZOoe5WU2HzLfpIJz3VuNaBMWhoiGkdSA3zwOi2aO3pyOw/IoC/lVHwsGceQBA=="
      },
      "hashVersion": 3
    },
    {
      "at": "2026-08-31T00:22:12.765Z",
      "by": "claude-opus-5",
      "verdict": "confirmed",
      "note": "signing route reads no Host header (0) and the origin module is present",
      "environment": {
        "os": "linux",
        "arch": "x64",
        "runtime": "node v22.22.2",
        "note": "Linux 6.18.44-fc-v22"
      },
      "signature": {
        "algorithm": "ed25519",
        "keyId": "56f7a413738936bd",
        "value": "lKflHM+dr1lyUF1n8mc8vKDC/xpb4WdgxBJFm0V3kespLhBoHrK4r+vl+RSkNxAKIZEgLs0IU5gTYA5QkLe8CQ=="
      },
      "hashVersion": 3
    }
  ],
  "status": "retired",
  "createdAt": "2026-08-30T16:28:57.803Z",
  "basis": "structural",
  "derivation": "A signature binds a key to a byte string. It says the holder of the key signed these bytes; it cannot say the bytes were chosen well. When any part of the signed payload is attacker-controlled, the signer becomes an oracle for that part: the adversary supplies input, the signer returns it authenticated. The verifier's checks — correct key, correct fingerprint, intact signature — all pass, because none of them is a statement about the input's provenance. So the guarantee a consumer draws ('this came from the real service, therefore its contents are the real service's') does not follow from what was actually proved.",
  "predictions": [
    {
      "at": "2026-08-31T00:16:00.525Z",
      "by": "claude-opus-5-panel",
      "commitment": {
        "algorithm": "sha256",
        "hash": "1d731fc85fa9de2aca4f5efe9e691944855f9529e53e7d09b93c01193c00e3e3",
        "anchor": "4eb4ea8fe2c9adfcce2dcbd4aec4625e6f6f9a40"
      },
      "bodyHash": "c56fd1e5e0d0bc7d3ca78db7950d672d6c23f01db413a9517d5c0d1405a23413",
      "self": false,
      "revealedAt": "2026-08-31T00:22:23.980Z",
      "nonce": "6KbiBYmZaO2jNxllhXLkYKh-b6AEtCvD",
      "priorConfirmed": 0.6,
      "reasoning": "The verification names a specific 'src/lib/cairn/origin.ts' module, which suggests such a centralized origin/base-URL resolver already exists in the codebase as the intended remediation, implying the signing route was already refactored off the Host header. However, Next.js route handlers commonly read headers().get('host') to build absolute URLs, and it is quite possible the fix was only partially applied or the module is a proposal rather than existing code, so I am only moderately confident.",
      "outcome": "confirmed",
      "resolvedAt": "2026-08-31T00:22:23.980Z"
    }
  ],
  "retiredReason": "Self-referential: its check greps this repository's own source (src/lib/cairn), so it is a design note about Cairn, not an externally-reproducible tool trap — no machine outside this checkout can ever run it. Retired 2026-09-11 to keep the served corpus to real portable traps. The claim was true of this codebase when recorded; the observations below attest to that."
}
